ad,domain,email,telefon,sehir,kaynak
Oregon Teknoloji Hizmetleri A.Ş.,oregontech.com.tr,info@oregon.com.tr,0216 362 09 89,İSTANBUL,UTIKAD
Orfe Denizcilik Nakliyat Turizm Tarım Ürünleri İthalat İhracat San. ve Tic. Ltd. Şti.,orfe.com.tr,orfe@orfe.com.tr,0324 233 90 08,MERSİN,UTIKAD
ORG Global Lojistik Ltd.Şti.,orggloballojistik.com,baris@orglojistik.com,0212 806 74 24,İSTANBUL,UTIKAD
Orient Ekspres Uluslararası Taşımacılık Turizm ve Ticaret Ltd. Şti.,orientekspres.com,info@orientekspres.com,0216 380 46 59,İSTANBUL,UTIKAD
Orion Cargo Solution Lojistik A.Ş.,krafttrans.com,y.ulufer@krafttrans.com,0532 780 07 97,İSTANBUL,UTIKAD
Orion Uluslararası Lojistik ve Dış Tic. Ltd. Şti.,oriontr.com,muhasebe@oriontr.com,0324 231 51 01,MERSİN,UTIKAD
Orship Uluslararası Taş. Hiz. ve Tic. Ltd. Şti.,orship.com.tr,farukkucukcelebi@orship.com.tr,0216 410 74 35,İSTANBUL,UTIKAD
OSF Uluslararası Lojistik Hiz. Dış Tic. A.Ş.,osfturkey.com,ik@osfturkey.com,0324 237 75 75,MERSİN,UTIKAD
Oto Irmak Motorlu Araçlar Tic. ve San. A.Ş.,irmakgrup.com.tr,ogunci@otoirmak.com.tr,0232 433 97 73,İZMİR,UTIKAD
Öykü Lojistik A.Ş.,oykugrup.com.tr,info@oykulogistics.com,444 69 58,İSTANBUL,UTIKAD
Öz Erkan Lojistik Nakliyat Otomotiv Petrol Gıda Ürünleri Sanayi ve Ticaret Ltd. Şti.,ozerkanlojistik.com,info@ozerkanlojistik.com,0324 239 27 21,MERSİN,UTIKAD
Öznakliyat Kara Taşımacılığı A.Ş.,oznakliyat.com.tr,info@oznakliyat.com.tr,0216 461 25 00,İSTANBUL,UTIKAD
Paket Taşımacılık Sistemleri A.Ş.,pts.net,cs@pts.net,0212 444 07 87,İSTANBUL,UTIKAD
Pan Lojistik Hizmetleri A.Ş.,panlogistics.com.tr,gulriz.kantek@panlogistics.com.tr,0212 579 30 00,İSTANBUL,UTIKAD
Pass Global Ulus. Taş. Dış Tic. Ltd. Şti.,kargopass.com,info@kargopass.com,0850 888 72 77,BURSA,UTIKAD
Pentagram Logistics Dış Ticaret Ltd. Şti.,pentagramlogistics.com,info@pentagramlogistics.com,0216 208 92 24,İSTANBUL,UTIKAD
Pers Lojistik Hiz. İth. İhr. İnş. San. Ltd. Şti.,pers.com.tr,alibal@pers.com.tr,0850 333 73 77,İSTANBUL,UTIKAD
Planet Uluslararası Taş. ve Dış Tic. Ltd. Şti.,planetlogistics.com.tr,info@planetlogistics.com.tr,0212 219 11 81,İSTANBUL,UTIKAD
PLH Lojistik Hizmetleri A.Ş.,plh.com.tr,info@plh.com.tr,0850 393 45 50,İSTANBUL,UTIKAD
Portera Lojistik A.Ş.,porteraglobal.com,info@porteraglobal.com,0212 824 43 72,İSTANBUL,UTIKAD
Posta ve Telgraf Teşkilatı A.Ş.,ptt.gov.tr,lojistikdaire@ptt.gov.tr,0312 509 58 00,ANKARA,UTIKAD
Profreight Taşımacılık Hizmetleri A.Ş.,profreight.com.tr,info@profreight.com.tr,0216 413 33 30,İSTANBUL,UTIKAD
Proje Kargo Yat Taşımacılık A.Ş.,project-yacht.com,info@project-yacht.com,0216 447 44 81,İSTANBUL,UTIKAD
Propa Denizcilik ve Ulus. Taş. Tic. A.Ş.,propatrans.com,propa@propatrans.com,0216 455 43 74,İSTANBUL,UTIKAD
PSA BDP International Lojistik Ltd. Şti.,bdpinternational.com,fikret.ersoy@bdpint.com,0212 346 06 01,İSTANBUL,UTIKAD
PSP Ekspres Taşımacılık Tic. Ltd. Şti.,pspexpress.com,,0850 255 2556,İSTANBUL,UTIKAD
Puma Denizcilik ve Lojistik A.Ş.,pumashipping.com,ftopcuoglu@pumashipping.com,0212 252 80 63,İSTANBUL,UTIKAD
Pyramids Lojistik Hizmetleri A.Ş.,pyramidsfreight.com,turkey@pyramidsfreight.com,0216 468 88 87,İSTANBUL,UTIKAD
QNT Lojistik Tic. Ltd. Şti.,quantumtrans.com,info@quantumtrans.com,0216 639 00 99,İSTANBUL,UTIKAD
QS Mikro Dağıtım A.Ş.,quickshipper.com,,0216 232 28 40,İSTANBUL,UTIKAD
Qualitairsea Lojistik Hizmetleri A.Ş.,qualitairsea.com.tr,info@qualitairsea.com.tr,0212 466 01 01,İSTANBUL,UTIKAD
Rahban Lojistik Nakliyat ve Dış Tic. Ltd. Şti.,rahbanlogistics.com,info@rahbanlogistics.com,0212 570 52 12,İSTANBUL,UTIKAD
Railport Terminal İşletmeleri A.Ş.,railport.com.tr,,0262 305 13 05,KOCAELİ,UTIKAD
Rapid Ulus.Taş. Turizm San. ve Tic. Ltd. Şti.,rapid.com.tr,rapid@rapid.com.tr,0212 252 38 33,İSTANBUL,UTIKAD
Raykam Lojistik Taşıma Madencilik İnşaat Orman Ürünleri San. ve Tic. A.Ş.,raykamlojistik.com.tr,info@raykamlojistik.com.tr,0262 644 46 16,KOCAELİ,UTIKAD
Redlog Taşımacılık Hizmetleri A.Ş.,red-log.com.tr,,0216 232 31 01,İSTANBUL,UTIKAD
Reibel Taşımacılık ve Ticaret A.Ş.,reibel.com.tr,info@reibel.com.tr,0212 426 87 00,İSTANBUL,UTIKAD
Rentrans Ulus. Taş. ve Tic. Ltd. Şti.,rentrans.com,info@rentrans.com,0216 574 63 33,İSTANBUL,UTIKAD
Rhenus Turkey Lojistik Ltd. Şti.,tr.rhenus.com,salesist@tr.rhenus.com,0212 293 26 00,İSTANBUL,UTIKAD
RLS Uluslararası Taşımacılık ve Tic. Ltd. Şti.,rls-logistics.com,operasyon@tr-rls.com,0212 596 26 50,İSTANBUL,UTIKAD
Rola Lojistik ve Uluslararası Taş. Ltd. Şti.,rolalogistics.com,info@rolalogistics.com,0232 390 91 60,İZMİR,UTIKAD
Royal Line Lojistik İç ve Dış Tic. Ltd. Şti.,rll.com.tr,info@rll.com.tr,0324 238 00 05,MERSİN,UTIKAD
Royal Lojistik ve Ulus. Taş. Dış Tic. Ltd. Şti.,royallojistik.com,sales@royallojistik.com,0216 510 49 34,İSTANBUL,UTIKAD
Rtm Lojistik İç ve Dış Ticaret A.Ş.,rtmlojistik.com.tr,info@rtmlojistik.com.tr,0326 502 47 97,HATAY,UTIKAD
RTSB İntermodal Taş. ve Loj. Tic. Ltd. Şti.,rtsb.de,info@rtsb.com.tr,0232 325 00 88,İZMİR,UTIKAD
S Lojistik Hizmetler A.Ş.,slojistik.com.tr,info@slojistik.com.tr,0212 465 46 92,İSTANBUL,UTIKAD
S Sistem Lojistik Hizmetler A.Ş.,ssistem.com,info@ssistem.com.tr,0212 468 25 00,İSTANBUL,UTIKAD
Sabay Lojistik A.Ş.,sabay.com.tr,info@sabay.com.tr,0212 217 36 20,İSTANBUL,UTIKAD
Sahra Havacılık ve Lojistik Hizmetler Ltd. Şti.,sahragroup.com,export@sahragroup.com,444 97 47,İSTANBUL,UTIKAD
Sal Antrepo ve Lojistik A.Ş.,sallojistik.com.tr,info@sallojistik.com.tr,0324 221 44 44,MERSİN,UTIKAD
Samer And Co Shipping Taşımacılık A.Ş.,samer.com,,0216 212 55 21,İSTANBUL,UTIKAD
Samsung SDS Global SCL Nak. ve Loj. A.Ş.,samsungsds.com,sinan.u@samsung.com,0212 437 88 15,İSTANBUL,UTIKAD
Sapphire Global Trading İnşaat Sanayi ve Dış Ticaret Ltd. Şti.,gtsapphire.com.tr,operasyon@gtsapphire.com.tr,0533 598 20 62,MERSİN,UTIKAD
Sarex Uluslararası Loj. ve Dış Tic. Ltd. Şti.,sarexlogistics.com.tr,accounting@sarexlogistics.com,0538 030 54 23,MERSİN,UTIKAD
Savino Del Bene Nakliyat A.Ş.,savinodelbene.com,turgay.cakar@savinodelbene.com,0212-395 14 40,İSTANBUL,UTIKAD
Saygınlar Ulus. Taş. Gıda San. ve Tic. Ltd. Şti.,sayginlarnakliyat.com,info@sayginlarnakliyat.com,0326 225 26 87,HATAY,UTIKAD
Scanwell Lojistik A.Ş.,scanwell.com,istanbul@batigroup.com.tr,0212 293 30 77,İSTANBUL,UTIKAD
Schenker Arkas Nakliyat ve Ticaret A.Ş.,dbschenkerarkas.com.tr,schist@dbschenkerarkas.com.tr,0212 336 00 36,İSTANBUL,UTIKAD
SEA World Denizcilik Ltd. Şti.,seaworldshipping.com,info@seaworldshipping.com,0212 251 18 18,İSTANBUL,UTIKAD
Seamark Uluslararası Taş. ve Tic. A.Ş.,seamark.biz,info@sea-mark.com.tr,0850 223 98 85,İZMİR,UTIKAD
Sega Lojistik ve Taşımacılık Dış Tic. Ltd. Şti.,segalojistik.com,operasyon@segalojistik.com,0212 510 05 55,İSTANBUL,UTIKAD
Select Bilişim Hizmetleri A.Ş.,selectyazilim.com,select@selectyazilim.com,0212 211 32 11,İSTANBUL,UTIKAD
Ser Den Denizcilik Taşımacılık Tic. Ltd. Şti.,ser-den.com,info@ser-den.com,0212 481 68 00,İSTANBUL,UTIKAD
Seray Uluslararası Taşımacılık İnş. Tic. Ltd. Şti.,seraytrans.com,semih@seraytrans.com,0212 451 51 01,İSTANBUL,UTIKAD
Serhatlı İnsan Kaynakları Lojistik Taş. ve Temizlik Hiz. Dış Ticaret Ltd. Şti.,serhatlilojistik.com,info@serhatlilojistik.com,0212 809 03 10,İSTANBUL,UTIKAD
Sertrans Ulus. Nak.Ticaret A.Ş.,sertrans.com.tr,info@sertrans.com.tr,0850 288 81 81 - 444 5 737,İSTANBUL,UTIKAD
Servex Global Lojistik ve Dış Tic. A.Ş.,servex.com.tr,info@servex.com.tr,0212 603 33 32,İSTANBUL,UTIKAD
SGS Transitnet Transit Sistemi Destek Hiz. A.Ş.,sgs.com.tr,transitnet.turkey@sgs.com,0212 368 40 20,İSTANBUL,UTIKAD
SH Lojistik Sanayi ve Ticaret A.Ş.,shlojistik.com,sh@shlojistik.com,0324 237 69 90,MERSİN,UTIKAD
Shipco Transport Uluslararası Nak. Ltd. Şti.,shipco.com,istsup@shipco.com,0212 252 80 20,İSTANBUL,UTIKAD
ShipLounge Loj. ve Yazılım Sis. San. Tic. Şti.,shiplounge.co,info@shiplounge.co,0850 308 10 38,ANKARA,UTIKAD
Sibel Uluslararası Taş. ve Dış Tic. Ltd. Şti.,sibel.com.tr,sibel@sibel.com.tr,0216 574 12 12,İSTANBUL,UTIKAD
Sigma Denizcilik Kon. ve Loj. San. Tic. Ltd. Şti.,sigmacontainer.com,design@sigmamodules.com,0212 852 00 30,İSTANBUL,UTIKAD
Silk Road Lojistik ve Dış Ticaret Ltd. Şti.,silkroadlojistik.com,info@silkroadlojistik.com,0216 456 52 72,İSTANBUL,UTIKAD
Sin Global Forwardıng Nak. San. ve Tic. Ltd. Şti.,singlobal.com.tr,info@singlobal.com.tr,0212 875 45 00,İSTANBUL,UTIKAD
Sina İthalat İhracat ve Ulus. Nak. Tic. Ltd. Şti.,sinaco.com.tr,transport@sinaco.com.tr,0216 385 38 22-23,İSTANBUL,UTIKAD
Sincer Lojistik A.Ş.,sincerlojistik.com.tr,info@sincerlojistik.com,0324 233 26 07,MERSİN,UTIKAD
Sinotrans Makzume Lojistik Ltd. Şti.,sinotrans.com,info@sinotrans-makzume.com,0850 288 45 90,İSTANBUL,UTIKAD
Sintek İnşaat Endüstriyel Tesisler A.Ş.,sinteklogistics.com,o.bute@sinteklogistics.com,0212 356 20 71,ANKARA,UTIKAD
Sittnak Lojistik A.Ş.,sittnak.com.tr,,0212 778 11 11,İSTANBUL,UTIKAD
SKY Logistics Hava Kara Deniz Taşımacılığı ve Dış Ticaret Ltd. Şti.,skylogistics.com.tr,cargo@skylogistics.com.tr,0530 233 20 03,İSTANBUL,UTIKAD
Skymar Lojistik Ltd. Şti.,skymar.com.tr,,0216 912 22 55,İSTANBUL,UTIKAD
SLF Lojistik Uluslararası Nakliyat Turizm İnşaat ve Ticaret Ltd. Şti.,slflogistic.com,selin@slflogistic.com,0216 784 64 62,İSTANBUL,UTIKAD
SNS Ekspres Lojistik Sanayi ve Ticaret Ltd. Şti.,snsexpressglobal.com,info@snsexpressglobal.com,0539 571 33 83,İSTANBUL,UTIKAD
SNS Uluslararası Nakliyat ve Dış Tic. Ltd. Şti.,sns-international.com,info@sns-international.com,0212 269 28 70,İSTANBUL,UTIKAD
SOFT İş Çözümleri A.Ş.,soft.com.tr,soft@soft.com.tr,0212 212 79 20,İSTANBUL,UTIKAD
Solibra Lojistik Hizmetleri A.Ş.,solibra.com.tr,solibra@solibra.com.tr,0216 416 30 62,İSTANBUL,UTIKAD
Solmaz Gümrük Müşavirliği A.Ş.,solmaz.com,info@solmaz.com,0212 334 02 34,İSTANBUL,UTIKAD
Soyer Nakliyat ve Ambalaj San. ve Tic. A.Ş.,soyer.com.tr,soyer@soyer.com.tr,0216 411 27 21,İSTANBUL,UTIKAD
Speedline Uluslararası Nak. ve Tic. Ltd. Şti.,speedlinetr.com,info@speedlinetr.com,0216 939 97 73,İSTANBUL,UTIKAD
ST Uluslararası Deniz Taşımacılığı Nakliyat Lojistik Hizmetleri ve Dış Tic. A.Ş.,stlojistik.com.tr,info@stlojistik.com.tr,0216 450 58 38,İSTANBUL,UTIKAD
Star Aır Sea Lojistik Hizmetleri Ltd. Şti.,starairsea.com,,,İSTANBUL,UTIKAD
Statü Gemi Kiralama ve Tic. Ltd. Şti.,statushipping.com,statu@statushipping.com,0216 531 23 00,İSTANBUL,UTIKAD
Stein Freight Lojistik A.Ş.,steinfreight.com,finance@steinfreight.com,0212 801 46 81,İSTANBUL,UTIKAD
Stoneway Ulus. Taş. İth. İhr. ve Tic. Ltd. Şti.,stoneway.com.tr,info@stoneway.com.tr,0242 244 79 29,ANTALYA,UTIKAD
Sud Marin Taşımacılık A.Ş.,sudmarin.com,koray.denizci@sudmarin.com,0212 890 08 82,İSTANBUL,UTIKAD
Supply Lojistik A.Ş.,supply-logistics.com,info@supply-logistics.com,0216 759 21 81,İSTANBUL,UTIKAD
Susa Shipping Services Dış Ticaret Ltd. Şti.,susashipping.com.tr,meral.horoz@susashipping.com.tr,0212 999 03 98,İSTANBUL,UTIKAD
Suvari Gemi Kiralama  ve Acenteliği Makina Turizm İnşaat Sanayi Tic. A.Ş.,suvarishipping.com,chartering@suvarishipping.com,0216 496 22 22,İSTANBUL,UTIKAD
Sürat Operasyonel Lojistik A.Ş.,suratlogistics.com,tarkan.turkel@suratlojistik.com,0216 557 09 11,İSTANBUL,UTIKAD
SVN Uluslararası Taş. İthalat İhracat  Ltd. Şti.,svn.com.tr,mehmet.sevenoglu@svn.com.tr,0324 504 25 33,MERSİN,UTIKAD
Synctrans Uluslararası Taşımacılık Ltd. Şti.,synctransintl.com,ozgun@synctransintl.com,0553 787 70 00,İSTANBUL,UTIKAD
Şehzade Lojistik Uluslararası Taşımacılık ve İthalat İhracat Ltd. Şti.,sehzadelojistik.com,sehzade@sehzadelojistik.com,0326 503 24 24,HATAY,UTIKAD
T.G.L. TetGlobal Lojistik Nak. San. ve Tic. A.Ş.,tetglobal.com,info@tetglobal.com,0216 327 93 30,İSTANBUL,UTIKAD
Talay Lojistik A.Ş.,talay.com,info@talay.com,0212 495 17 00,İSTANBUL,UTIKAD
Talos Denizcilik ve Uluslararası Taş. A.Ş.,talos.com.tr,talos@talos.com.tr,0216 449 34 05,İSTANBUL,UTIKAD
Tan Global Lojistik Danışmanlık ve Eğitim Hizmetleri Ticaret Ltd. Şti.,tanlogistics.com.tr,info@tanlogistics.com.tr,0212 854 01 55,İSTANBUL,UTIKAD
Tan-Air Uluslararası Taşımacılık Ltd. Şti.,tanair.com.tr,info@tanair.com.tr,0212 288 00 90,İSTANBUL,UTIKAD
Tandem Lojistik Servisler Taş. ve Tic. Ltd. Şti.,tandemlojistik.com.tr,info@tandemlojistik.com.tr,0212 695 74 34,İSTANBUL,UTIKAD
TAR-SHA Uluslararası Lojistik Hiz. Tic. Ltd. Şti.,tar-sha.com,info@tar-sha.com,0312 354 59 01,ANKARA,UTIKAD
TBH Lojistik Hiz. Ltd. Şti.,tbhlog.com,batu.erkan@tbhlog.com,0216 228 42 47,İSTANBUL,UTIKAD
TCT Lojistik A.Ş.,tcttr.com,info@tcttr.com,444 98 28,İSTANBUL,UTIKAD
Tek San Lojis. Tic. Danış. İth. ve İhr. Ltd. Şti.,teksanlojistik.com.tr,operasyon3@teksanlojistik.com.tr,0212 452 96 64,İSTANBUL,UTIKAD
Terra Transport Ulus. Taşıma İşleri Organizatörlüğü ve Tic. Ltd. Şti.,terra-spedition.com,info@terra-spedition.com,0216 391 24 07,İSTANBUL,UTIKAD
Thor Uluslararası Denizcilik Kumanyacılık Liman Hizmetleri Pazarlama A.Ş.,thormarinesa.com.tr,thor@thormarinesa.com.tr,0212 438 00 39,İSTANBUL,UTIKAD
Tırsan Uluslararası Taş. ve Dış Tic. Ltd. Şti.,tirsanlogistics.com,zeliha@tirsanlogistics.com,0530 959 87 87,İSTANBUL,UTIKAD
Tiba Turkey Taşımacılık A.Ş.,tibagroup.com,kkaya@tibagroup.com,0537 950 85 80,İSTANBUL,UTIKAD
Tim Global Lojistik A.Ş.,timglobal.com.tr,info@timglobal.com.tr,0850 255 08 08,İSTANBUL,UTIKAD
TİO Lojistik Taşımacılık Depolama Danışmanlık Kimya Satış Pazarlama San. ve Tic. Ltd. Şti.,tiolojistik.com.tr,info@tiolojistik.com.tr,0216 688 08 46 - 0216 688 48 46,İSTANBUL,UTIKAD
TİT Ulus. Nak. Deri Teks. Gıda San. ve Tic. Ltd. Şti.,tittransport.com,tit@tittransport.com,0216 455 47 63,İSTANBUL,UTIKAD
TLS Lojistik A.Ş.,tlslojistik.com,,444 94 11,İSTANBUL,UTIKAD
TMA Transcontinental Uluslararası Nakliyat Ticaret ve Gümrükleme A.Ş.,tmatrans.com,a.akova@tmatrans.com,0212 244 54 28 - 0212 245 43 14,İSTANBUL,UTIKAD
TMGD TR Mühendislik Ltd. Şti.,tmgdmuhendislik.com,info@tmgdmuhendislik.com,0212 674 17 87,İSTANBUL,UTIKAD
Tolkun Lojistik Ltd. Şti.,tolkun.org,erkut@tolkun.org,0216 348 73 48,İSTANBUL,UTIKAD
Trade Factory Global Lojistik Dış Tic. Ltd. Şti.,global-tradefactory.com,,0216 266 76 60,İSTANBUL,UTIKAD
Trans Global Proje Lojistik Ltd. Şti.,tglobal.com,,0212 274 71 61,İSTANBUL,UTIKAD
Transalkım Uluslararası Nak. ve Tic. Ltd. Şti.,transalkim.com.tr,muhasebe@transalkim.com.tr,0212 774 22 70,İSTANBUL,UTIKAD
Transhat Uluslararası Taşımacılık Tic. Ltd. Şti.,transhat.com,info@transhat.com,0212 426 41 35,İSTANBUL,UTIKAD
Transmap Lojistik A.Ş.,trans-map.com,huseyin.ozkan@trans-map.com,0216 415 34 14,İSTANBUL,UTIKAD
Transmec Uluslararası Taşımacılık Tic. Ltd. Şti.,transmecgroup.it,transmec@transmecgroup.it,0212 251 53 54,İSTANBUL,UTIKAD
Transorient Global Lojistik A.Ş.,transorient.com.tr,info@transorient.com.tr,0212 467 26 00,İSTANBUL,UTIKAD
Trasant Uluslararası Nakliyat ve Dış Tic. Ltd. Şti.,trasant.com,trasant@trasant.com.tr,0212 854 35 00,İSTANBUL,UTIKAD
Trendyol Lojistik A.Ş.,trendyol.com,,0212 331 0200,İSTANBUL,UTIKAD
Tria Lojistik Hizmetler Ticaret A.Ş.,trialogistics.com,tria@tlh.com.tr,0324 328 20 50,MERSİN,UTIKAD
Troya İç ve Dış Ticaret Dan. Paz. ve Taş. Ltd. Şti.,troyatrade.com.tr,tukenmez@troyatrade.com.tr,0312 479 10 94,ANKARA,UTIKAD
Trukker Teknoloji Ltd. Şti.,trukker.com,,0216 440 40 81,İSTANBUL,UTIKAD
TTR Lojistik Hizmetleri Ticaret A.Ş.,ttrlog.com,,0212 653 34 45,İSTANBUL,UTIKAD
Tuaz Nak. Aracılık Hiz. İnş. San. ve Tic. Ltd. Şti.,tuaz.com.tr,muhasebe@tuaz.com.tr,0541 334 54 52,TEKİRDAĞ,UTIKAD
Tunaset Biofarma Lojistik Hizmetleri A.Ş.,biotunaset.com,operations@biotunaset.com,0212 428 52 35,İSTANBUL,UTIKAD
Turing Global Lojistik ve Bilişim Hizmetleri A.Ş.,turinglog.com,info@turinglog.com,0850 255 20 41,İZMİR,UTIKAD
Turklog Uluslararası Taş. ve Loj. A.Ş.,turklog.com.tr,info@turklog.com.tr,0216 755 44 55,İSTANBUL,UTIKAD
Turkon Lojistik A.Ş.,turkon.com,info@turkon.com,0216 544 18 00,İSTANBUL,UTIKAD
Turkroro Denizcilik ve Taşımacılık A.Ş.,turkroro.com.tr,info@turkroro.com.tr,0212 807 27 71,İSTANBUL,UTIKAD
Turnak Gümrük Müşavirliği Ltd. Şti.,turnakgumruk.com.tr,ETA@turnakgumruk.com.tr,0212 413 77 00,İSTANBUL,UTIKAD
Tüfekçi Fuarcılık Organizasyon Uluslararası Nakliyat Gıda Dış Tic. San. ve Tic. Ltd. Şti.,tufekcitrans.com,g.tufekci@tufekcitrans.com,0216 577 20 67,İSTANBUL,UTIKAD
Türk Hava Yolları A.O.,thy.com.tr,baharc@thy.com,0212 463 63 63,İSTANBUL,UTIKAD
Türkmen Grup Lojistik Hizmetleri A.Ş.,turkmenlogistics.com,info@turkmenlogistics.com,0212 315 47 00,İSTANBUL,UTIKAD
UKGS Ulus. Kargo Gönderim Serv. ve Tic. A.Ş.,ukgs.net,info@ukgs.com.tr,0850 300 85 47,İSTANBUL,UTIKAD
Ultima Uluslararası Taş. Loj. ve Dış Tic. Ltd. Şti.,ultimalogistics.com,info@ultimalogistics.com,0216 688 26 00,İSTANBUL,UTIKAD
Ulukom Bilg. Yazılım Donanım Danış. ve Tic. A.Ş.,ulukom.com.tr,erkin@ulukom.com.tr,0216 680 35 35,İSTANBUL,UTIKAD
Ulusal Lojistik Antrepo Hiz. Dış Tic. A.Ş.,ulusalantrepo.com.tr,info@ulusalantrepo.com.tr,0216 622 53 83,İSTANBUL,UTIKAD
Ulustrans Lojistik A.Ş.,ulustrans.com.tr,finans@ulustrans.com.tr,0212 411 45 45,İSTANBUL,UTIKAD
UMT Uluslararası Taşımacılık A.Ş.,umtlogistic.com,info@umtlogistic.com,0212 665 30 38 - 0544 972 20 80,İSTANBUL,UTIKAD
Unico Global Uluslararası  Taş. Ltd. Şti.,unicologx.com,turkey@unicologx.com,0212 871 25 26,İSTANBUL,UTIKAD
Universal Denizcilik Proje Taş. ve Tic. A.Ş,universalproject.com.tr,project@universalproject.com.tr,0216 680 09 91,İSTANBUL,UTIKAD
UPS SCS Uluslararası Nakliyat Ltd. Şti.,ups.com,bburgazlioglu@ups.com,0212 413 22 22 - 0212 413 24 43,İSTANBUL,UTIKAD
UTG Uluslararası Nakliyat Ltd. Şti.,utg.com.tr,utg@utg.com.tr,0212 211 22 33,İSTANBUL,UTIKAD
Uzman Yük Sabitleme ve Lojistik Hiz. Ltd. Şti.,uzmangloballogistics.com.tr,project@uzmangloballogistics.com.tr,0850 220 21 91,MERSİN,UTIKAD
Ülgen Denizcilik ve Lojistik San. Tic. A.Ş.,ulgen.com,logistics@ulgen.com,0216 478 48 49,İSTANBUL,UTIKAD
V Mar Organizasyon Nakliyat ve Tic. Ltd. Şti.,v-mar.org,info@v-mar.org,0212 243 80 80,İSTANBUL,UTIKAD
Van Trans Taşımacılık İç ve Dış Tic. Ltd. Şti.,vantrans.com.tr,vantrans@vantrans.com.tr,0432 215 66 39,VAN,UTIKAD
Vanguard Turkey Lojistik Hizmetler A.Ş.,vls-global.com,finance.tr@vanguardlogistics.com,0216 410 85 55,İSTANBUL,UTIKAD
Vavien Lojistik A.Ş.,vavien.com,sales@vavienlogistics.com,0224 909 11 19,BURSA,UTIKAD
Vazin Lojistik Dış Ticaret A.Ş.,vazinlojistik.com,info@vazinlojistik.com,0216 573 69 98,İSTANBUL,UTIKAD
Vegamar Denizcilik ve Taşımacılık Tic. A.Ş.,vegamar.com,info@vegamar.com,0212 249 93 77,İSTANBUL,UTIKAD
Velox Line Den. Loj. Tic. Ltd. Şti.,velocline.com,info@veloxline.com,0536 970 08 82,MERSİN,UTIKAD
Vera Lojistik A.Ş.,veralog.com,info@veralog.com,0212 211 50 10,İSTANBUL,UTIKAD
Verimex Transit Lojistik A.Ş.,verimextransit.com,info@verimextransit.com,0212 803 06 06,İSTANBUL,UTIKAD
Veritas Ticaret Lojistik A.Ş.,veritasas.com,veritas@veritasas.com,444 14 79,İSTANBUL,UTIKAD
Veysel Oğulları Loj. Nak. Kiralama Turizm Hayvancılık Gıda İth. İhr. ve Tic. Ltd. Şti.,veyselogullari.com.tr,veysel@veyselogullari.com.tr,0312 812 29 49,ANKARA,UTIKAD
Viking Kargo Ltd. Şti.,vikingcargo.com.tr,info@vikingcargo.com.tr,0212 334 27 70,İSTANBUL,UTIKAD
VİP Uluslararası Taşımacılık ve Dış Ticaret A.Ş.,viptransport.com.tr,info@viptransport.com.tr,0212 771 62 00,İSTANBUL,UTIKAD
VTK Lojistik Dış Ticaret ve Turizm A.Ş.,vtk.com.tr,volkan.tek@vtk.com.tr,0533 922 31 40,İSTANBUL,UTIKAD
Waylog Ulus. Taş. Hiz. Ltd. Şti.,waylog.com.tr,operation@waylog.com.tr,0850 441 09 56,MERSİN,UTIKAD
Weld Uluslararası Taşımacılık Hizmetleri A.Ş.,weld-int.com,,0212 697 00 77,İSTANBUL,UTIKAD
Well Enerji Uluslararası Nakliyat ve Loj. A.Ş.,well.uk.com,serap@well.com.tr,0216 580 85 40,İSTANBUL,UTIKAD
Wing Loj. Ulus. Taş. ve Otom. Sist. Tic. Ltd. Şti.,winglojistik.com.tr,okan.acar@winglojistik.com.tr,0530 039 77 88,İZMİR,UTIKAD
Wiz Lojistik Ticaret Ltd. Şti.,wizlog.com.tr,muhasebe@wizlog.com.tr,0850 216 34 27,İSTANBUL,UTIKAD
WİZGROUP Kurumsal Tedarik ve Lojistik A.Ş.,wizgroup.com.tr,info@wizlog.com.tr,0342 215 01 90,GAZİANTEP,UTIKAD
Wonderland Lojistik Servisler Taş. Tic. Ltd. Şti.,wonderlandlojistik.com,info@wonderlandlojistik.com,0212 302 01 07,İSTANBUL,UTIKAD
World Courier Taşımacılık ve Lojistik Hizmetleri Tic. Ltd. Şti.,worldcourier.com,cselcuk@worldcourier.com.tr,0212 541 10 55,İSTANBUL,UTIKAD
WWL Turkey Lojistik A.Ş.,worldwidelogisticsltd.com,,0212 954 00 99,İSTANBUL,UTIKAD
Yakup Lojistik Hizmetleri İnşaat Nakliyat Gıda Sanayi ve Ticaret Ltd. Şti.,yakuplojistik.com,info@yakuplojistik.com,0326 221 37 77,HATAY,UTIKAD
Yedaiah Int. Group Loj.Dış Tic. İth. İhr. Ltd. Şti.,yedaiah.com,info@yedaiah.com,0850 390 27 28,AYDIN,UTIKAD
Yeditepe Taşımacılık A.Ş.,yeditepecargo.com,info@yeditepecargo.com,0232 463 03 52,İZMİR,UTIKAD
Yekaş & Fides Global Lojistik A.Ş.,yekas.com.tr,m.guler@yekas.com,0212 910 00 00,İSTANBUL,UTIKAD
Yeniay Lojistik A.Ş.,yeniaylojistik.com.tr,info@yeniaylojistik.com.tr,0212 452 40 01,İSTANBUL,UTIKAD
Yeskon Konteyner Taşımacılık Hizmetleri Denizcilik ve Dış Tic. A.Ş.,yeskon.com.tr,info@yeskon.com.tr,0232 465 11 25,İZMİR,UTIKAD
YGL Lojistik Ticaret A.Ş.,ygllogistics.com,info@ygllogistics.com,0224 242 15 11,BURSA,UTIKAD
Yılnak Proje ve Ağır Taşıma Servisi A.Ş.,yilnak.com.tr,yilnak@yilnak.com.tr,444 4 956,ANKARA,UTIKAD
Yrt Global Lojistik ve Dış Ticaret A.Ş.,yrtglobal.com,muhasebe@yurtintermodal.com,0850 888 5 324,MERSİN,UTIKAD
YSL Uluslararası Nak. Dış Tic. A.Ş.,yslogistic.com,info@yslogistic.com,0216 369 76 20,İSTANBUL,UTIKAD
Yukcon Log. Den. ve Taş. Hiz. San. ve Tic. Ltd. Şti.,yukconlogistics.com,info@yukconlogistics.com,0232 311 29 11,İZMİR,UTIKAD
Yusen İnci Lojistik ve Ticaret A.Ş.,yusen-logistics.com,info@tr.yusen-logistics.com,0212 259 37 77,İSTANBUL,UTIKAD
Yüce Transport Uluslararası Taşımacılık A.Ş.,yucetrans.com,yuce@yucetrans.com,0212 347 47 56,İSTANBUL,UTIKAD
Zafer Tank Taşıma Uluslararası Nakliyat Turizm ve Tic. Ltd. Şti.,zafertanktasima.com,info@zafertanktasima.com,0216 575 03 17 - 0262 751 44 43,İSTANBUL,UTIKAD
Zen Ulaştırma ve Loj. Hiz. San. Tic. Ltd. Şti.,zenulastirma.com,info@zenulastirma.com,0342 606 02 22,GAZİANTEP,UTIKAD
ZLS Danışmanlık Dış Ticaret Ltd. Şti.,zls-logistik.de,,0534 719 53 53,İSTANBUL,UTIKAD
27 ŞAHİN LOJİSTİK SAN.VE TİC.LTD.ŞTİ.,sahinlojistik27.com,,+903429097404,Gaziantep,UND
2K HEDEF ULUSLARARASI NAKLİYAT VE PAZ. TİC. LTD. ŞTİ.,2khedef.com,,02165104660,İstanbul,UND
7KITA LOJİSTİK OTOMOTİV NAKLİYAT İNŞ.TAR.HAY.İTH.İHR.SAN.VE TİC.LTD.ŞTİ.,,,,Mardin,UND
ABA PROJECT ULUS. TAŞ. VE DIŞ TİC. LTD. ŞTİ.,abaproject.com.tr,,02325024400,İzmir,UND
ABA TRANS TAŞIMACILIK İTH. İHR. SAN.VE TİC. LTD. ŞTİ.,abatranstasimacilik.com,,+905325951335,Gaziantep,UND
ABA TUR ULUS. LOJİSTİK SAN. VE TİC. LTD. ŞTİ.,,,+905322155111,Gaziantep,UND
ABANT GLOBAL LOJİSTİK TİC. SAN. LTD. ŞTİ.,abantglobal.com,,+903742227575,Bolu,UND
ABANT NAKLİYAT TİC.VE SAN.A.Ş.,abantnakliyat.com,,03742152181,Bolu,UND
ABC ULUS. TRANSPORT TİC. VE SAN. A.Ş.,abclojistik.com,,+903523114040,Kayseri,UND
ABS İNTERNATİONAL REMOVALS TRANSPORT KARGO TİC.LTD.ŞTİ.,abstransport.com.tr,,+908502152727,Gaziantep,UND
ACAPET TAŞ.AKAR.TİC.LTD.ŞTİ.,acapet.com,,+03123977839,Ankara,UND
ACAR GLOBAL LOJİSTİK VE DIŞ TİC. LTD. ŞTİ.,acrlojistik.com.tr,,+905303916353,İstanbul,UND
AÇAR LOJİSTİK TAŞ.EMLAKÇILIK OTOMOTİV TEL.MAR.İTH.İHR.TİC.LTD.ŞTİ.,acarlogs.com,,+903262142079,Hatay,UND
AÇARLAR ULUSLARARASI TAŞ. İÇ VE DIŞ TİC.LTD.ŞTİ.,acarlartransport.com,,+902127360315,İstanbul,UND
ACETOĞLU PET.ÜRÜN.OTOM.NAK.İNŞ.GIDA.LTD.ŞTİ.,acetoglu.com,,+905324024074,Mersin,UND
